{
  "gate": {"exit_code": 1},
  "hardFailures": [],
  "warningReasons": {"version": 1, "codes": []},
  "policy": "retry",
  "shadowFailures": [],
  "schema": "sejong-check/1",
  "attempt": 1,
  "sentences": [
    {"id": "S1", "request": null, "status": "unchanged", "codes": [], "repairs": []},
    {"id": "S2", "request": "R1", "status": "retry", "codes": ["voice_level"], "repairs": []},
    {"id": "S3", "request": null, "status": "deterministic", "codes": [], "repairs": ["norm_fix"]},
    {"id": "S4", "request": null, "status": "unchanged", "codes": [], "repairs": []},
    {"id": "S5", "request": null, "status": "unchanged", "codes": [], "repairs": []}
  ],
  "retry": [
    {"id": "R1", "sentence": "S2",
     "violations": [{"code": "voice_level", "family": "voice", "severity": "hard", "sentence": "S2",
                     "detail": "HAPSYO->HAEYO", "keep": "바뀌었습니다."}]}
  ],
  "requestStatus": {"FIXED": 0, "UNTOUCHED": 0, "STILL_PRESENT": 1, "LOST": 0, "DECLINED": 0},
  "counts": {"revertedSentences": 0, "revertedByFamily": {}, "collateralReverts": 0,
             "voiceGrafts": 0, "cmcRestored": 0, "normFixes": 1, "repairedParticles": 0,
             "removedCommas": 0, "restoredSentences": 0},
  "changeRate": 0.104
}
